[
  {
    "slug": "googleworkspace/cli",
    "name": "gws",
    "description": "Unified CLI for Google Workspace APIs — Drive, Gmail, Calendar, Sheets, Docs, and Chat. Dynamically built from the Google Discovery Service.",
    "github": "googleworkspace/cli",
    "install": { "npm": "@googleworkspace/cli" }
  },
  {
    "slug": "stripe/stripe-cli",
    "name": "stripe-cli",
    "description": "The official CLI for the Stripe API. Test webhooks, trigger events, and manage your Stripe integration from the terminal.",
    "github": "stripe/stripe-cli"
  },
  {
    "slug": "cli/cli",
    "name": "gh",
    "description": "GitHub's official CLI. Bring pull requests, issues, GitHub Actions, and more to your terminal.",
    "github": "cli/cli"
  },
  {
    "slug": "vercel/vercel",
    "name": "vercel",
    "description": "Deploy and manage your Vercel projects from the command line. Instant deploys, previews, and environment management.",
    "github": "vercel/vercel",
    "install": { "npm": "vercel" }
  },
  {
    "slug": "aws/aws-cli",
    "name": "aws-cli",
    "description": "The official AWS command line interface. Manage your AWS services directly from the terminal.",
    "github": "aws/aws-cli",
    "install": { "pip": "awscli" }
  },
  {
    "slug": "docker/cli",
    "name": "docker",
    "description": "The CLI for Docker. Build, run, and manage containers and images from the terminal.",
    "github": "docker/cli"
  },
  {
    "slug": "schpet/linear-cli",
    "name": "linear",
    "description": "A CLI for Linear. Create issues, manage projects, and interact with your Linear workspace from the terminal.",
    "github": "schpet/linear-cli",
    "install": { "npm": "@schpet/linear-cli" }
  },
  {
    "slug": "google-gemini/gemini-cli",
    "name": "gemini-cli",
    "description": "Google's open-source AI agent that brings Gemini directly into your terminal. Supports 1M token context and is extensible via plugins.",
    "github": "google-gemini/gemini-cli",
    "install": { "npm": "@google/gemini-cli" }
  },
  {
    "slug": "anomalyco/opencode",
    "name": "opencode",
    "description": "An open-source AI coding agent built for the terminal. Supports multiple LLM providers and runs autonomously on real codebases.",
    "github": "anomalyco/opencode"
  },
  {
    "slug": "Aider-AI/aider",
    "name": "aider",
    "description": "AI pair programming in your terminal. Aider lets you edit code in your local git repo using GPT-4 and other LLMs.",
    "github": "Aider-AI/aider",
    "install": { "pip": "aider-chat" }
  },
  {
    "slug": "AgentlyHQ/use-agently",
    "name": "use-agently",
    "description": "The routing and settlement layer for your agent economy. Discover, coordinate, and transact with autonomous AI agents.",
    "github": "AgentlyHQ/use-agently"
  },
  {
    "slug": "vysheng/tg",
    "name": "tg",
    "description": "Command-line Telegram client. Send messages, manage chats, and interact with the Telegram API directly from your terminal.",
    "github": "vysheng/tg"
  },
  {
    "slug": "amantus-ai/vibetunnel",
    "name": "vibetunnel",
    "description": "Turn any browser into your terminal — command agents from the road via vt.sh.",
    "github": "amantus-ai/vibetunnel"
  },
  {
    "slug": "steipete/CodexBar",
    "name": "CodexBar",
    "description": "macOS menu bar app to keep agent token limits and usage in view.",
    "github": "steipete/CodexBar"
  },
  {
    "slug": "steipete/Peekaboo",
    "name": "peekaboo",
    "description": "Lightning-fast macOS screenshots and GUI automation — native Swift CLI with built-in MCP server.",
    "github": "steipete/Peekaboo",
    "install": { "brew": "@steipete/peekaboo" }
  },
  {
    "slug": "steipete/summarize",
    "name": "summarize",
    "description": "Point at any URL or file and get the gist — summarization CLI.",
    "github": "steipete/summarize"
  },
  {
    "slug": "steipete/RepoBar",
    "name": "RepoBar",
    "description": "macOS menu bar app showing CI status, PRs, and releases at a glance.",
    "github": "steipete/RepoBar"
  },
  {
    "slug": "steipete/gogcli",
    "name": "gogcli",
    "description": "Google in your terminal — Gmail, Calendar, Drive, Contacts, Tasks, Sheets, Docs, Slides, People.",
    "github": "steipete/gogcli"
  },
  {
    "slug": "steipete/poltergeist",
    "name": "Poltergeist",
    "description": "Universal hot reload and file watcher — keeps builds fresh automatically.",
    "github": "steipete/poltergeist"
  },
  {
    "slug": "steipete/wacli",
    "name": "wacli",
    "description": "WhatsApp CLI — sync, search, and send messages from your terminal.",
    "github": "steipete/wacli"
  },
  {
    "slug": "steipete/discrawl",
    "name": "discrawl",
    "description": "Mirror Discord into SQLite and search server history locally.",
    "github": "steipete/discrawl"
  },
  {
    "slug": "steipete/sag",
    "name": "sag",
    "description": "ElevenLabs TTS with mac-style say UX — streams to speakers by default.",
    "github": "steipete/sag"
  },
  {
    "slug": "steipete/brabble",
    "name": "Brabble",
    "description": "Wake-word voice daemon for macOS — transcribes locally and fires configurable hooks.",
    "github": "steipete/brabble"
  },
  {
    "slug": "steipete/sonoscli",
    "name": "sonoscli",
    "description": "Control Sonos speakers from the terminal — discover, group, queue, and play Spotify.",
    "github": "steipete/sonoscli"
  },
  {
    "slug": "steipete/ElevenLabsKit",
    "name": "ElevenLabsKit",
    "description": "ElevenLabs voices on tap — SwiftPM-friendly, streaming-native Swift library.",
    "github": "steipete/ElevenLabsKit"
  },
  {
    "slug": "steipete/goplaces",
    "name": "goplaces",
    "description": "Google Places API (New) client and CLI.",
    "github": "steipete/goplaces"
  },
  {
    "slug": "steipete/gifgrep",
    "name": "gifgrep",
    "description": "GIF search for terminals — CLI output and TUI with inline previews.",
    "github": "steipete/gifgrep"
  },
  {
    "slug": "steipete/camsnap",
    "name": "camsnap",
    "description": "RTSP snapshots, clips, and motion detection CLI — Tapo-friendly.",
    "github": "steipete/camsnap"
  },
  {
    "slug": "steipete/spogo",
    "name": "spogo",
    "description": "Spotify in the terminal — playback control using web cookies.",
    "github": "steipete/spogo"
  },
  {
    "slug": "steipete/ordercli",
    "name": "ordercli",
    "description": "Track your takeout timeline from the terminal.",
    "github": "steipete/ordercli"
  },
  {
    "slug": "steipete/blucli",
    "name": "blucli",
    "description": "Play, group, and automate BluOS audio systems from the terminal.",
    "github": "steipete/blucli"
  },
  {
    "slug": "polymarket/polymarket-cli",
    "name": "polymarket-cli",
    "description": "Rust CLI for Polymarket. Browse markets, place orders, manage positions, and interact with onchain contracts — from a terminal or as a JSON API for scripts and agents.",
    "github": "polymarket/polymarket-cli"
  },
  {
    "slug": "nunchi-trade/agent-cli",
    "name": "agent-cli",
    "github": "nunchi-trade/agent-cli"
  },
  {
    "slug": "lydakis/mcpx",
    "name": "mcpx",
    "github": "lydakis/mcpx"
  }
]